{
  "date": "2026-06-02",
  "author": "Test Author",
  "tags": ["practice", "attention"],
  "themes": ["craft"],
  "topic": "revision as reading",
  "trigger": "rereading a finished draft",
  "context": "fourth pass on a novelette",
  "mood": "focused",
  "insights": ["revising is reading aloud with a pencil"],
  "lessons_learned": ["cut the first paragraph"],
  "questions_raised": ["where does the scene actually start?"],
  "actions_to_take": ["reread chapter three aloud"],
  "related_reflections": []
}
